{
  "$schema": "http://json-schema.org/draft-07/schema#",
  "title": "Strict Symptom Classifications Schema",
  "description": "LLM-validated symptom classifications (~2200 records)",
  "type": "array",
  "items": {
    "type": "object",
    "properties": {
      "vaccine_name": {"type": "string", "description": "PDF vaccine name"},
      "vaers_name": {"type": "string", "description": "VAERS vaccine name"},
      "symptom": {"type": "string", "description": "VAERS symptom name"},
      "classification": {"type": "string", "enum": ["confirmed", "not_confirmed"], "description": "Whether symptom is documented in PDF"},
      "matched_pdf_event": {"type": "string", "description": "Matching PDF adverse event or 'none'"},
      "vaers_count": {"type": "integer", "description": "Number of times this symptom was reported"}
    },
    "required": ["vaccine_name", "vaers_name", "symptom", "classification", "matched_pdf_event", "vaers_count"]
  }
}