[
  {
    "vaccine_name": "COVID19 (COVID19 (MNEXSPIKE))",
    "vaers_name": "COVID19 (COVID19 (PFIZER-BIONTECH))",
    "symptom": "Sacral pain",
    "classification": "not_confirmed",
    "matched_pdf_event": "none",
    "vaers_count": 15
  },
  {
    "vaccine_name": "COVID19 (COVID19 (MNEXSPIKE))",
    "vaers_name": "COVID19 (COVID19 (PFIZER-BIONTECH))",
    "symptom": "Sensory overload",
    "classification": "not_confirmed",
    "matched_pdf_event": "none",
    "vaers_count": 10
  },
  {
    "vaccine_name": "COVID19 (COVID19 (MNEXSPIKE))",
    "vaers_name": "COVID19 (COVID19 (PFIZER-BIONTECH))",
    "symptom": "Ear pain",
    "classification": "not_confirmed",
    "matched_pdf_event": "none",
    "vaers_count": 2376
  },
  {
    "vaccine_name": "COVID19 (COVID19 (MNEXSPIKE))",
    "vaers_name": "COVID19 (COVID19 (PFIZER-BIONTECH))",
    "symptom": "Base excess increased",
    "classification": "not_confirmed",
    "matched_pdf_event": "none",
    "vaers_count": 10
  },
  {
    "vaccine_name": "COVID19 (COVID19 (MNEXSPIKE))",
    "vaers_name": "COVID19 (COVID19 (PFIZER-BIONTECH))",
    "symptom": "Electrocardiogram QT interval",
    "classification": "not_confirmed",
    "matched_pdf_event": "none",
    "vaers_count": 51
  },
  {
    "vaccine_name": "COVID19 (COVID19 (MNEXSPIKE))",
    "vaers_name": "COVID19 (COVID19 (PFIZER-BIONTECH))",
    "symptom": "Transferrin",
    "classification": "not_confirmed",
    "matched_pdf_event": "none",
    "vaers_count": 12
  },
  {
    "vaccine_name": "COVID19 (COVID19 (MNEXSPIKE))",
    "vaers_name": "COVID19 (COVID19 (PFIZER-BIONTECH))",
    "symptom": "Chondrocalcinosis pyrophosphate",
    "classification": "not_confirmed",
    "matched_pdf_event": "none",
    "vaers_count": 10
  },
  {
    "vaccine_name": "COVID19 (COVID19 (MNEXSPIKE))",
    "vaers_name": "COVID19 (COVID19 (PFIZER-BIONTECH))",
    "symptom": "Myelopathy",
    "classification": "not_confirmed",
    "matched_pdf_event": "none",
    "vaers_count": 17
  },
  {
    "vaccine_name": "COVID19 (COVID19 (MNEXSPIKE))",
    "vaers_name": "COVID19 (COVID19 (PFIZER-BIONTECH))",
    "symptom": "Non-Hodgkin's lymphoma",
    "classification": "not_confirmed",
    "matched_pdf_event": "none",
    "vaers_count": 14
  },
  {
    "vaccine_name": "COVID19 (COVID19 (MNEXSPIKE))",
    "vaers_name": "COVID19 (COVID19 (PFIZER-BIONTECH))",
    "symptom": "Alcohol poisoning",
    "classification": "not_confirmed",
    "matched_pdf_event": "none",
    "vaers_count": 16
  },
  {
    "vaccine_name": "COVID19 (COVID19 (MNEXSPIKE))",
    "vaers_name": "COVID19 (COVID19 (PFIZER-BIONTECH))",
    "symptom": "Nipple pain",
    "classification": "not_confirmed",
    "matched_pdf_event": "none",
    "vaers_count": 81
  },
  {
    "vaccine_name": "COVID19 (COVID19 (MNEXSPIKE))",
    "vaers_name": "COVID19 (COVID19 (PFIZER-BIONTECH))",
    "symptom": "Culture stool",
    "classification": "not_confirmed",
    "matched_pdf_event": "none",
    "vaers_count": 82
  },
  {
    "vaccine_name": "COVID19 (COVID19 (MNEXSPIKE))",
    "vaers_name": "COVID19 (COVID19 (PFIZER-BIONTECH))",
    "symptom": "Hand-eye coordination impaired",
    "classification": "not_confirmed",
    "matched_pdf_event": "none",
    "vaers_count": 11
  },
  {
    "vaccine_name": "COVID19 (COVID19 (MNEXSPIKE))",
    "vaers_name": "COVID19 (COVID19 (PFIZER-BIONTECH))",
    "symptom": "Heart injury",
    "classification": "not_confirmed",
    "matched_pdf_event": "none",
    "vaers_count": 26
  },
  {
    "vaccine_name": "COVID19 (COVID19 (MNEXSPIKE))",
    "vaers_name": "COVID19 (COVID19 (PFIZER-BIONTECH))",
    "symptom": "Anti-thyroid antibody positive",
    "classification": "not_confirmed",
    "matched_pdf_event": "none",
    "vaers_count": 43
  },
  {
    "vaccine_name": "COVID19 (COVID19 (MNEXSPIKE))",
    "vaers_name": "COVID19 (COVID19 (PFIZER-BIONTECH))",
    "symptom": "Renal function test",
    "classification": "not_confirmed",
    "matched_pdf_event": "none",
    "vaers_count": 164
  },
  {
    "vaccine_name": "COVID19 (COVID19 (MNEXSPIKE))",
    "vaers_name": "COVID19 (COVID19 (PFIZER-BIONTECH))",
    "symptom": "Renal cyst",
    "classification": "not_confirmed",
    "matched_pdf_event": "none",
    "vaers_count": 71
  },
  {
    "vaccine_name": "COVID19 (COVID19 (MNEXSPIKE))",
    "vaers_name": "COVID19 (COVID19 (PFIZER-BIONTECH))",
    "symptom": "Laryngitis",
    "classification": "not_confirmed",
    "matched_pdf_event": "none",
    "vaers_count": 131
  },
  {
    "vaccine_name": "COVID19 (COVID19 (MNEXSPIKE))",
    "vaers_name": "COVID19 (COVID19 (PFIZER-BIONTECH))",
    "symptom": "Microscopy",
    "classification": "not_confirmed",
    "matched_pdf_event": "none",
    "vaers_count": 64
  },
  {
    "vaccine_name": "COVID19 (COVID19 (MNEXSPIKE))",
    "vaers_name": "COVID19 (COVID19 (PFIZER-BIONTECH))",
    "symptom": "Superficial vein prominence",
    "classification": "not_confirmed",
    "matched_pdf_event": "none",
    "vaers_count": 11
  },
  {
    "vaccine_name": "SHINGRIX (ZOSTER VACCINE RECOMBINANT, ADJUVANTED)",
    "vaers_name": "ZOSTER (SHINGRIX)",
    "symptom": "Cough",
    "classification": "not_confirmed",
    "matched_pdf_event": "none",
    "vaers_count": 296
  },
  {
    "vaccine_name": "SHINGRIX (ZOSTER VACCINE RECOMBINANT, ADJUVANTED)",
    "vaers_name": "ZOSTER (SHINGRIX)",
    "symptom": "Weight bearing difficulty",
    "classification": "not_confirmed",
    "matched_pdf_event": "none",
    "vaers_count": 23
  },
  {
    "vaccine_name": "SHINGRIX (ZOSTER VACCINE RECOMBINANT, ADJUVANTED)",
    "vaers_name": "ZOSTER (SHINGRIX)",
    "symptom": "Sinus pain",
    "classification": "not_confirmed",
    "matched_pdf_event": "none",
    "vaers_count": 13
  },
  {
    "vaccine_name": "SHINGRIX (ZOSTER VACCINE RECOMBINANT, ADJUVANTED)",
    "vaers_name": "ZOSTER (SHINGRIX)",
    "symptom": "Borrelia test negative",
    "classification": "not_confirmed",
    "matched_pdf_event": "none",
    "vaers_count": 24
  },
  {
    "vaccine_name": "SHINGRIX (ZOSTER VACCINE RECOMBINANT, ADJUVANTED)",
    "vaers_name": "ZOSTER (SHINGRIX)",
    "symptom": "Injected limb mobility decreased",
    "classification": "not_confirmed",
    "matched_pdf_event": "none",
    "vaers_count": 501
  },
  {
    "vaccine_name": "SHINGRIX (ZOSTER VACCINE RECOMBINANT, ADJUVANTED)",
    "vaers_name": "ZOSTER (SHINGRIX)",
    "symptom": "Hallucination",
    "classification": "not_confirmed",
    "matched_pdf_event": "none",
    "vaers_count": 39
  },
  {
    "vaccine_name": "SHINGRIX (ZOSTER VACCINE RECOMBINANT, ADJUVANTED)",
    "vaers_name": "ZOSTER (SHINGRIX)",
    "symptom": "Antinuclear antibody",
    "classification": "not_confirmed",
    "matched_pdf_event": "none",
    "vaers_count": 14
  },
  {
    "vaccine_name": "SHINGRIX (ZOSTER VACCINE RECOMBINANT, ADJUVANTED)",
    "vaers_name": "ZOSTER (SHINGRIX)",
    "symptom": "Dysgeusia",
    "classification": "not_confirmed",
    "matched_pdf_event": "none",
    "vaers_count": 48
  },
  {
    "vaccine_name": "SHINGRIX (ZOSTER VACCINE RECOMBINANT, ADJUVANTED)",
    "vaers_name": "ZOSTER (SHINGRIX)",
    "symptom": "Mental status changes",
    "classification": "not_confirmed",
    "matched_pdf_event": "none",
    "vaers_count": 24
  },
  {
    "vaccine_name": "SHINGRIX (ZOSTER VACCINE RECOMBINANT, ADJUVANTED)",
    "vaers_name": "ZOSTER (SHINGRIX)",
    "symptom": "Gait disturbance",
    "classification": "not_confirmed",
    "matched_pdf_event": "none",
    "vaers_count": 370
  },
  {
    "vaccine_name": "SHINGRIX (ZOSTER VACCINE RECOMBINANT, ADJUVANTED)",
    "vaers_name": "ZOSTER (SHINGRIX)",
    "symptom": "Night sweats",
    "classification": "not_confirmed",
    "matched_pdf_event": "none",
    "vaers_count": 113
  },
  {
    "vaccine_name": "SHINGRIX (ZOSTER VACCINE RECOMBINANT, ADJUVANTED)",
    "vaers_name": "ZOSTER (SHINGRIX)",
    "symptom": "Limb discomfort",
    "classification": "confirmed",
    "matched_pdf_event": "myalgia",
    "vaers_count": 186
  },
  {
    "vaccine_name": "SHINGRIX (ZOSTER VACCINE RECOMBINANT, ADJUVANTED)",
    "vaers_name": "ZOSTER (SHINGRIX)",
    "symptom": "Swelling of eyelid",
    "classification": "confirmed",
    "matched_pdf_event": "swelling",
    "vaers_count": 49
  },
  {
    "vaccine_name": "SHINGRIX (ZOSTER VACCINE RECOMBINANT, ADJUVANTED)",
    "vaers_name": "ZOSTER (SHINGRIX)",
    "symptom": "Eye disorder",
    "classification": "not_confirmed",
    "matched_pdf_event": "none",
    "vaers_count": 23
  },
  {
    "vaccine_name": "SHINGRIX (ZOSTER VACCINE RECOMBINANT, ADJUVANTED)",
    "vaers_name": "ZOSTER (SHINGRIX)",
    "symptom": "Erythema multiforme",
    "classification": "not_confirmed",
    "matched_pdf_event": "none",
    "vaers_count": 12
  },
  {
    "vaccine_name": "SHINGRIX (ZOSTER VACCINE RECOMBINANT, ADJUVANTED)",
    "vaers_name": "ZOSTER (SHINGRIX)",
    "symptom": "Lip blister",
    "classification": "not_confirmed",
    "matched_pdf_event": "none",
    "vaers_count": 36
  },
  {
    "vaccine_name": "SHINGRIX (ZOSTER VACCINE RECOMBINANT, ADJUVANTED)",
    "vaers_name": "ZOSTER (SHINGRIX)",
    "symptom": "Depressed level of consciousness",
    "classification": "not_confirmed",
    "matched_pdf_event": "none",
    "vaers_count": 20
  },
  {
    "vaccine_name": "SHINGRIX (ZOSTER VACCINE RECOMBINANT, ADJUVANTED)",
    "vaers_name": "ZOSTER (SHINGRIX)",
    "symptom": "Gastrooesophageal reflux disease",
    "classification": "not_confirmed",
    "matched_pdf_event": "none",
    "vaers_count": 17
  },
  {
    "vaccine_name": "SHINGRIX (ZOSTER VACCINE RECOMBINANT, ADJUVANTED)",
    "vaers_name": "ZOSTER (SHINGRIX)",
    "symptom": "Diarrhoea",
    "classification": "confirmed",
    "matched_pdf_event": "gastrointestinal symptoms",
    "vaers_count": 855
  },
  {
    "vaccine_name": "SHINGRIX (ZOSTER VACCINE RECOMBINANT, ADJUVANTED)",
    "vaers_name": "ZOSTER (SHINGRIX)",
    "symptom": "Laboratory test normal",
    "classification": "not_confirmed",